{"file_id":"CPR-F-EXAMPLE-MANUSCRIPT","path_or_uri":"chapter-v1.docx","filename":"chapter-v1.docx","extension":"docx","version_id":"v1","declared_purpose":"current clean manuscript","status":"current","clean_state":"clean","hash_or_stable_id":"sha256:example","supersedes":null,"evidence_id":"CPR-E-EXAMPLE-TITLE","owner":"production coordinator","last_modified":"2026-08-13T00:00:00Z"}
